{
  "schema_version": 1,
  "engine_version": "0.1.0-alpha.3",
  "protocol_version": "domains.canonical.v0.2",
  "context": {
    "dataset_id": "synthetic-qualified_technical_repeats",
    "content_version": "1.0.0",
    "source_id": "nir",
    "target_id": "concentration",
    "split_id": "explicit-v1"
  },
  "data_origin": "synthetic",
  "status": "partial",
  "test_target_accessed": false,
  "policy": {
    "independence_unit": "physical_sample",
    "representation": "technical_mean",
    "audit_mode": "pre_training",
    "seed": 17,
    "pca_max_components": 3,
    "pca_variance_fraction": 0.95
  },
  "provenance": {
    "domains": "0.1.0-alpha.3",
    "fixture_generator": "controlled-v1; deterministic; no RNG draws",
    "methods": "1.3.6+abi.2.19.0",
    "methods_abi": "2.19.0",
    "methods_binary_sha256": "096bae41ffc5e4f6ec8d73b0ca43f0cec83f66dda806b2d43b2d893ba07db164",
    "preflight": "0.1.0-alpha.1",
    "sanitized_task_sha256": "c301c5469a72b11e3a0faae178ceffd82c6283298a4522c173657f7fad7a4d94"
  },
  "fit": {
    "eigenvalues": [
      36.000000000000014
    ],
    "fit_observation_ids": [
      "mean:5c313414d42b0a37f2e80a0d2081b887b40c1833dee99c29a5784a716eab13ee",
      "mean:fc8800a68a0587a543bbf9f8f8c6238b885699317b5f470dcf207647ca06b806",
      "o-train-2",
      "o-train-3",
      "o-train-4",
      "o-train-5",
      "o-train-6",
      "o-train-7"
    ],
    "fit_partition": "train",
    "fit_x_sha256": "9a4b8d2a158431b394806f05350c2052cc4931dc1e9a70d2335fec5aa0aa361b",
    "full_moments": [
      36.0,
      1296.0
    ],
    "loadings": [
      [
        0.408248290463863,
        0.816496580927726,
        -0.408248290463863
      ]
    ],
    "mean": [
      0.5,
      1.0,
      0.5
    ],
    "n_components": 1,
    "nn_threshold": 2.449489742783178,
    "reconstruction_squared_threshold": 3.8499999999999996e-11,
    "requested_variance_reached": true,
    "retained_variance_fraction": 1.0000000000000004,
    "solver": "Methods automatic; exact or deterministic approximate depending on matrix shape; solver flag not exposed by ABI",
    "threshold_rule": "train q75 + 1.5 IQR; residual numerical floor 1e-12*(1+mean_norm_squared+trace)"
  },
  "preflight": {
    "capabilities": [
      {
        "available": true,
        "capability_id": "integrity",
        "qualified": false,
        "reason": "ALPHA_PROTOCOL_UNQUALIFIED"
      },
      {
        "available": true,
        "capability_id": "target.coverage",
        "qualified": false,
        "reason": "ALPHA_PROTOCOL_UNQUALIFIED"
      },
      {
        "available": true,
        "capability_id": "methods.pca",
        "qualified": false,
        "reason": "Methods 1.3.6+abi.2.19.0 ABI 2.18; alpha protocol"
      },
      {
        "available": true,
        "capability_id": "methods.repeatability",
        "qualified": false,
        "reason": "Methods 1.3.6+abi.2.19.0 ABI 2.18; alpha protocol"
      },
      {
        "available": true,
        "capability_id": "methods.summary",
        "qualified": false,
        "reason": "Methods 1.3.6+abi.2.19.0 ABI 2.18; alpha protocol"
      },
      {
        "available": true,
        "capability_id": "methods.nearest_neighbors",
        "qualified": false,
        "reason": "Methods 1.3.6+abi.2.19.0 ABI 2.18; alpha protocol"
      },
      {
        "available": true,
        "capability_id": "methods.local_contrast",
        "qualified": false,
        "reason": "Methods 1.3.6+abi.2.19.0 ABI 2.18; alpha protocol"
      },
      {
        "available": false,
        "capability_id": "validation_probe",
        "qualified": false,
        "reason": "PROTOCOL_NOT_IMPLEMENTED"
      },
      {
        "available": false,
        "capability_id": "clustering",
        "qualified": false,
        "reason": "PROTOCOL_NOT_IMPLEMENTED"
      },
      {
        "available": false,
        "capability_id": "confounding",
        "qualified": false,
        "reason": "PROTOCOL_NOT_IMPLEMENTED"
      },
      {
        "available": false,
        "capability_id": "domain_shift",
        "qualified": false,
        "reason": "PROTOCOL_NOT_IMPLEMENTED"
      },
      {
        "available": false,
        "capability_id": "noise_proxy",
        "qualified": false,
        "reason": "PROTOCOL_NOT_IMPLEMENTED"
      },
      {
        "available": false,
        "capability_id": "repeatability_uncertainty",
        "qualified": false,
        "reason": "PROTOCOL_NOT_IMPLEMENTED"
      },
      {
        "available": false,
        "capability_id": "snv_sensitivity",
        "qualified": false,
        "reason": "PROTOCOL_NOT_IMPLEMENTED"
      },
      {
        "available": false,
        "capability_id": "quasi_duplicates",
        "qualified": false,
        "reason": "PROTOCOL_NOT_IMPLEMENTED"
      },
      {
        "available": false,
        "capability_id": "metadata_association_tests",
        "qualified": false,
        "reason": "PROTOCOL_NOT_IMPLEMENTED"
      },
      {
        "available": true,
        "capability_id": "local.descriptive",
        "qualified": false,
        "reason": "ALPHA_PROTOCOL_UNQUALIFIED"
      }
    ],
    "data_origin": "synthetic",
    "engine_version": "0.1.0-alpha.1",
    "findings": [
      {
        "action": "Review physical identities and partition assignment before fitting",
        "confidence": "unknown",
        "evidence": [
          "integrity.cross_partition_exact_duplicate_pairs"
        ],
        "message": "10 exact spectral pairs span development and retained test in nir",
        "rule_id": "identity.possible_cross_partition_duplicate.v1",
        "severity": "high"
      }
    ],
    "limitations": [
      "Alpha protocols have not passed cross-language scientific qualification",
      "No validation probe or calibrated thresholds are available"
    ],
    "metrics": [
      {
        "denominators": {},
        "metric_id": "population.development_real_samples",
        "parameters": {},
        "population_id": "development_real",
        "protocol_version": "0.1.0-alpha.1",
        "reason_code": null,
        "scope": "source_target",
        "source_id": null,
        "status": "computed",
        "target_id": null,
        "unit": null,
        "value": 8,
        "view_id": "native"
      },
      {
        "denominators": {},
        "metric_id": "population.retained_test_samples",
        "parameters": {},
        "population_id": "development_real",
        "protocol_version": "0.1.0-alpha.1",
        "reason_code": null,
        "scope": "source_target",
        "source_id": null,
        "status": "computed",
        "target_id": null,
        "unit": null,
        "value": 8,
        "view_id": "native"
      },
      {
        "denominators": {},
        "metric_id": "population.augmented_samples_excluded",
        "parameters": {},
        "population_id": "development_real",
        "protocol_version": "0.1.0-alpha.1",
        "reason_code": null,
        "scope": "source_target",
        "source_id": null,
        "status": "computed",
        "target_id": null,
        "unit": null,
        "value": 0,
        "view_id": "native"
      },
      {
        "denominators": {
          "n_cells": 54
        },
        "metric_id": "integrity.missing_cells",
        "parameters": {},
        "population_id": "development_real",
        "protocol_version": "0.1.0-alpha.1",
        "reason_code": null,
        "scope": "source_target",
        "source_id": "nir",
        "status": "computed",
        "target_id": null,
        "unit": null,
        "value": 0,
        "view_id": "native"
      },
      {
        "denominators": {},
        "metric_id": "integrity.axis_order",
        "parameters": {
          "axis_transform": "none; source column order retained"
        },
        "population_id": "development_real",
        "protocol_version": "0.1.0-alpha.1",
        "reason_code": null,
        "scope": "source_target",
        "source_id": "nir",
        "status": "computed",
        "target_id": null,
        "unit": "nm",
        "value": "ascending",
        "view_id": "native"
      },
      {
        "denominators": {
          "n_observations_source": 18
        },
        "metric_id": "integrity.development_observations",
        "parameters": {},
        "population_id": "development_real",
        "protocol_version": "0.1.0-alpha.1",
        "reason_code": null,
        "scope": "source_target",
        "source_id": "nir",
        "status": "computed",
        "target_id": null,
        "unit": null,
        "value": 10,
        "view_id": "native"
      },
      {
        "denominators": {
          "n_development_observations": 10
        },
        "metric_id": "integrity.cross_physical_exact_duplicate_pairs",
        "parameters": {
          "normalization": "f64_bits_with_negative_zero_normalized_and_masked_cell_sentinel"
        },
        "population_id": "development_real",
        "protocol_version": "0.1.0-alpha.1",
        "reason_code": null,
        "scope": "source_target",
        "source_id": "nir",
        "status": "computed",
        "target_id": null,
        "unit": null,
        "value": 0,
        "view_id": "native"
      },
      {
        "denominators": {
          "n_affected_development_observations": 10,
          "n_affected_retained_test_observations": 8,
          "n_development_observations": 10,
          "n_retained_test_observations": 8
        },
        "metric_id": "integrity.cross_partition_exact_duplicate_pairs",
        "parameters": {
          "normalization": "f64_bits_with_negative_zero_normalized_and_masked_cell_sentinel",
          "test_access": "X_only_integrity_no_fit_no_Y"
        },
        "population_id": "development_real_vs_retained_test_real",
        "protocol_version": "0.1.0-alpha.1",
        "reason_code": null,
        "scope": "source_target",
        "source_id": "nir",
        "status": "computed",
        "target_id": null,